[
 {
  "brand": "Apple",
  "model": "iPhone 18 Pro Max",
  "core": true,
  "announce_date": "2026-09-09",
  "year": 2026,
  "chip": "Apple A20 Pro (2 nm)",
  "chip_variants": [],
  "battery_mAh": 5391,
  "weight_g": 249.0,
  "screen_inch": 6.9,
  "resolution": "2868x1320",
  "refresh_hz": 120,
  "refresh_note": null,
  "os_at_launch": "iOS 27",
  "official_endurance_hours": 45,
  "source_url": "https://www.apple.com/iphone-18-pro/specs/",
  "source_type": "official",
  "battery_source_url": "https://eprel.ec.europa.eu/api/products/smartphonestablets20231669/2774823/fiches?noRedirect=false&language=EN",
  "battery_source_type": "filing",
  "image_url": "https://fdn2.gsmarena.com/vv/bigpic/apple-iphone18-pro-max.jpg",
  "image_source": "gsmarena",
  "image_page_url": "https://www.gsmarena.com/apple_iphone_18_pro_max-14716.php",
  "image_note": null,
  "checked_date": "2026-10-29",
  "field_status": {
   "chip": "confirmed",
   "battery_mAh": "confirmed",
   "weight_g": "confirmed",
   "screen_inch": "confirmed",
   "resolution": "confirmed",
   "refresh_hz": "confirmed",
   "os_at_launch": "confirmed"
  },
  "notes": "battery: EU EPREL 2774823 (A3717) Product Information Sheet, rated capacity; US eSIM version 5567mAh; GSMArena cross-ref: https://www.gsmarena.com/apple_iphone_18_pro_max-14716.php; Apple does not publish mAh; battery: EU EPREL reg. 2774823, model A3717 (SIM-tray EU model), rated 5391 mAh; US eSIM-only version 5567 mAh per China 3C/MacRumors"
 },
 {
  "brand": "Apple",
  "model": "iPhone 18 Pro",
  "core": true,
  "announce_date": "2026-09-09",
  "year": 2026,
  "chip": "Apple A20 Pro (2 nm)",
  "chip_variants": [],
  "battery_mAh": 4056,
  "weight_g": 211.0,
  "screen_inch": 6.3,
  "resolution": "2622x1206",
  "refresh_hz": 120,
  "refresh_note": null,
  "os_at_launch": "iOS 27",
  "official_endurance_hours": 36,
  "source_url": "https://www.apple.com/iphone-18-pro/specs/",
  "source_type": "official",
  "battery_source_url": "https://eprel.ec.europa.eu/api/products/smartphonestablets20231669/2774822/fiches?noRedirect=false&language=EN",
  "battery_source_type": "filing",
  "image_url": "https://fdn2.gsmarena.com/vv/bigpic/apple-iphone18-pro.jpg",
  "image_source": "gsmarena",
  "image_page_url": "https://www.gsmarena.com/apple_iphone_18_pro-14934.php",
  "image_note": null,
  "checked_date": "2026-10-29",
  "field_status": {
   "chip": "confirmed",
   "battery_mAh": "confirmed",
   "weight_g": "confirmed",
   "screen_inch": "confirmed",
   "resolution": "confirmed",
   "refresh_hz": "confirmed",
   "os_at_launch": "confirmed"
  },
  "notes": "battery: EU EPREL reg. 2774822, model A3714 (SIM-tray EU model), rated 4056 mAh; China 3C matches; US eSIM-only version 4288 mAh per China 3C/MacRumors; Apple does not publish mAh; GSMArena cross-ref: https://www.gsmarena.com/apple_iphone_18_pro-14934.php"
 },
 {
  "brand": "Apple",
  "model": "iPhone 17e",
  "core": true,
  "announce_date": "2026-03-02",
  "year": 2026,
  "chip": "Apple A19 (3 nm)",
  "chip_variants": [],
  "battery_mAh": 4005,
  "weight_g": 169.0,
  "screen_inch": 6.1,
  "resolution": "2532x1170",
  "refresh_hz": 60,
  "refresh_note": null,
  "os_at_launch": "iOS 26.3",
  "official_endurance_hours": 26,
  "source_url": "https://www.apple.com/iphone-17e/specs/",
  "source_type": "official",
  "battery_source_url": "https://regulatoryinfo.apple.com/cwt/api/ext/file?fileId=energyLabels%2FA3634_V1%2FA3634%2FA3634_Product_Information_Sheet_EU_English.pdf",
  "battery_source_type": "filing",
  "image_url": "https://fdn2.gsmarena.com/vv/bigpic/apple-iphone-17e.jpg",
  "image_source": "gsmarena",
  "image_page_url": "https://www.gsmarena.com/apple_iphone_17e-14487.php",
  "image_note": null,
  "checked_date": "2026-10-29",
  "field_status": {
   "chip": "confirmed",
   "battery_mAh": "confirmed",
   "weight_g": "confirmed",
   "screen_inch": "confirmed",
   "resolution": "confirmed",
   "refresh_hz": "inferred",
   "os_at_launch": "confirmed"
  },
  "notes": "battery: Apple EU Product Information Sheet (A3634), rated capacity; no high refresh listed; 60Hz; GSMArena cross-ref: https://www.gsmarena.com/apple_iphone_17e-14487.php; Apple does not publish mAh; battery: Apple EU Product Information Sheet, model A3634, rated 4005 mAh; refresh 60 Hz inferred: official page lists no ProMotion/refresh rate"
 },
 {
  "brand": "Apple",
  "model": "iPhone 17 Pro Max",
  "core": true,
  "announce_date": "2025-09-09",
  "year": 2025,
  "chip": "Apple A19 Pro (3 nm)",
  "chip_variants": [],
  "battery_mAh": 4823,
  "weight_g": 233.0,
  "screen_inch": 6.9,
  "resolution": "2868x1320",
  "refresh_hz": 120,
  "refresh_note": null,
  "os_at_launch": "iOS 26",
  "official_endurance_hours": null,
  "source_url": "https://www.gsmarena.com/apple_iphone_17_pro_max-13964.php",
  "source_type": "gsmarena",
  "battery_source_url": "https://eprel.ec.europa.eu/api/products/smartphonestablets20231669/2402618/fiches?noRedirect=false&language=EN",
  "battery_source_type": "filing",
  "image_url": "https://fdn2.gsmarena.com/vv/bigpic/apple-iphone-17-pro-max.jpg",
  "image_source": "gsmarena",
  "image_page_url": "https://www.gsmarena.com/apple_iphone_17_pro_max-13964.php",
  "image_note": null,
  "checked_date": "2026-10-29",
  "field_status": {
   "chip": "confirmed",
   "battery_mAh": "confirmed",
   "weight_g": "confirmed",
   "screen_inch": "confirmed",
   "resolution": "confirmed",
   "refresh_hz": "confirmed",
   "os_at_launch": "confirmed"
  },
  "notes": "battery: EU energy label (A3526) / China CCC, SIM-tray version; eSIM-only version 5088mAh; Apple does not publish mAh; battery: EU EPREL reg. 2402618, model A3526 (SIM-tray), rated 4823 mAh; eSIM-only version 5088 mAh (China CCC via MacRumors/IT之家)"
 },
 {
  "brand": "Apple",
  "model": "iPhone 17 Pro",
  "core": true,
  "announce_date": "2025-09-09",
  "year": 2025,
  "chip": "Apple A19 Pro (3 nm)",
  "chip_variants": [],
  "battery_mAh": 3988,
  "weight_g": 206.0,
  "screen_inch": 6.3,
  "resolution": "2622x1206",
  "refresh_hz": 120,
  "refresh_note": null,
  "os_at_launch": "iOS 26",
  "official_endurance_hours": null,
  "source_url": "https://www.gsmarena.com/apple_iphone_17_pro-14049.php",
  "source_type": "gsmarena",
  "battery_source_url": "https://eprel.ec.europa.eu/api/products/smartphonestablets20231669/2402615/fiches?noRedirect=false&language=EN",
  "battery_source_type": "filing",
  "image_url": "https://fdn2.gsmarena.com/vv/bigpic/apple-iphone-17-pro.jpg",
  "image_source": "gsmarena",
  "image_page_url": "https://www.gsmarena.com/apple_iphone_17_pro-14049.php",
  "image_note": null,
  "checked_date": "2026-10-29",
  "field_status": {
   "chip": "confirmed",
   "battery_mAh": "confirmed",
   "weight_g": "confirmed",
   "screen_inch": "confirmed",
   "resolution": "confirmed",
   "refresh_hz": "confirmed",
   "os_at_launch": "confirmed"
  },
  "notes": "battery: EU energy label (A3523) / China CCC, SIM-tray version; eSIM-only version 4252mAh; corrected from 3998 (GSMArena); Apple does not publish mAh; battery: EU EPREL reg. 2402615, model A3523 (SIM-tray), rated 3988 mAh; eSIM-only version 4252 mAh (China CCC via MacRumors/IT之家)"
 },
 {
  "brand": "Apple",
  "model": "iPhone Air",
  "core": true,
  "announce_date": "2025-09-09",
  "year": 2025,
  "chip": "Apple A19 Pro (3 nm)",
  "chip_variants": [],
  "battery_mAh": 3149,
  "weight_g": 165.0,
  "screen_inch": 6.5,
  "resolution": "2736x1260",
  "refresh_hz": 120,
  "refresh_note": null,
  "os_at_launch": "iOS 26",
  "official_endurance_hours": 27,
  "source_url": "https://www.apple.com/iphone-air/specs/",
  "source_type": "official",
  "battery_source_url": "https://eprel.ec.europa.eu/api/products/smartphonestablets20231669/2402612/fiches?noRedirect=false&language=EN",
  "battery_source_type": "filing",
  "image_url": "https://fdn2.gsmarena.com/vv/bigpic/apple-iphone-air.jpg",
  "image_source": "gsmarena",
  "image_page_url": "https://www.gsmarena.com/apple_iphone_17_air-13502.php",
  "image_note": null,
  "checked_date": "2026-10-29",
  "field_status": {
   "chip": "confirmed",
   "battery_mAh": "confirmed",
   "weight_g": "confirmed",
   "screen_inch": "confirmed",
   "resolution": "confirmed",
   "refresh_hz": "confirmed",
   "os_at_launch": "confirmed"
  },
  "notes": "battery: EU EPREL fiche 2402612 (A3517), rated capacity; China CCC also lists a 3036mAh cell; GSMArena cross-ref: https://www.gsmarena.com/apple_iphone_17_air-13502.php; Apple does not publish mAh; battery: EU EPREL reg. 2402612, model A3517, rated 3149 mAh. iPhone Air has no SIM-tray version (eSIM-only in all markets); China CCC also lists a 3036 mAh cell (alternate pack)"
 },
 {
  "brand": "Apple",
  "model": "iPhone 17",
  "core": true,
  "announce_date": "2025-09-09",
  "year": 2025,
  "chip": "Apple A19 (3 nm)",
  "chip_variants": [],
  "battery_mAh": 3692,
  "weight_g": 177.0,
  "screen_inch": 6.3,
  "resolution": "2622x1206",
  "refresh_hz": 120,
  "refresh_note": null,
  "os_at_launch": "iOS 26",
  "official_endurance_hours": 30,
  "source_url": "https://www.apple.com/iphone-17/specs/",
  "source_type": "official",
  "battery_source_url": "https://eprel.ec.europa.eu/api/products/smartphonestablets20231669/2402623/fiches?noRedirect=false&language=EN",
  "battery_source_type": "filing",
  "image_url": "https://fdn2.gsmarena.com/vv/bigpic/apple-iphone-17.jpg",
  "image_source": "gsmarena",
  "image_page_url": "https://www.gsmarena.com/apple_iphone_17-14050.php",
  "image_note": null,
  "checked_date": "2026-10-29",
  "field_status": {
   "chip": "confirmed",
   "battery_mAh": "confirmed",
   "weight_g": "confirmed",
   "screen_inch": "confirmed",
   "resolution": "confirmed",
   "refresh_hz": "confirmed",
   "os_at_launch": "confirmed"
  },